{
  "format_version": "1.0",
  "roadmap_version": "example-not-for-activation",
  "project_name": "AZ Permit Radar",
  "repository_root_name": "AZPR",
  "base_branch": "main",
  "generated_from": {
    "prompt_manifest": "automation/prompt-manifest.json",
    "prompt_count": 38,
    "generated_at": "EXAMPLE",
    "generator_prompt": "automation/roadmap-generator-prompt.md"
  },
  "normal_execution": {
    "maximum_stages_per_run": 1,
    "include_appendix_a": true,
    "include_appendix_b": false,
    "include_appendix_c": false
  },
  "stages": [
    {
      "id": "001",
      "sequence": 1,
      "title": "Close the Post-Core Traceability Release Gate",
      "stage_group": "S1 - Traceability Gate",
      "prompt_file": "automation/numbered/001-close-the-post-core-traceability-release-gate.md",
      "effort_label": "Extra High",
      "reasoning_effort": "xhigh",
      "kind": "implementation",
      "sandbox": "workspace-write",
      "branch_slug": "close-the-post-core-traceability-release-gate",
      "prerequisites": [],
      "audit_gate": {
        "mode": "none",
        "allowed_outcomes": []
      },
      "human_approval": {
        "required_before_run": false,
        "approval_files": []
      },
      "context_files": [
        "README.md",
        "docs/current/",
        "docs/adr/",
        "docs/runbooks/",
        "docs/audits/index.json"
      ],
      "allowed_change_paths": [
        "src/**",
        "tests/**",
        "docs/**",
        "scripts/**",
        "pyproject.toml",
        "README.md",
        ".github/**",
        "frontend/**",
        "app/**",
        "migrations/**"
      ],
      "forbidden_change_paths": [
        "automation/**",
        ".codex-loop/**",
        ".git/**"
      ],
      "validation": {
        "commands": [
          {
            "name": "Complete Python test suite",
            "argv": [
              "python3",
              "-m",
              "unittest",
              "discover",
              "-s",
              "tests",
              "-v"
            ],
            "timeout_seconds": 1800
          }
        ]
      },
      "commit": {
        "required": true,
        "allowed_outcomes": [
          "COMPLETED"
        ],
        "message_template": "Stage {id}: {title} [{outcome}]"
      },
      "audit": {
        "formal": false,
        "report_slug": ""
      },
      "codex_timeout_seconds": 7200,
      "notes": [
        "Example metadata only; regenerate from the live repository before activation."
      ]
    },
    {
      "id": "002",
      "sequence": 2,
      "title": "Post-Core Traceability Corrective Audit",
      "stage_group": "S1 - Traceability Gate",
      "prompt_file": "automation/numbered/002-post-core-traceability-corrective-audit.md",
      "effort_label": "Ultra",
      "reasoning_effort": "xhigh",
      "kind": "audit",
      "sandbox": "read-only",
      "branch_slug": "post-core-traceability-corrective-audit",
      "prerequisites": [
        "001"
      ],
      "audit_gate": {
        "mode": "none",
        "allowed_outcomes": []
      },
      "human_approval": {
        "required_before_run": false,
        "approval_files": []
      },
      "context_files": [
        "README.md",
        "docs/current/",
        "docs/adr/",
        "docs/runbooks/",
        "docs/audits/index.json"
      ],
      "allowed_change_paths": [],
      "forbidden_change_paths": [
        "automation/**",
        ".codex-loop/**",
        ".git/**"
      ],
      "validation": {
        "commands": [
          {
            "name": "Complete Python test suite",
            "argv": [
              "python3",
              "-m",
              "unittest",
              "discover",
              "-s",
              "tests",
              "-v"
            ],
            "timeout_seconds": 1800
          }
        ]
      },
      "commit": {
        "required": true,
        "allowed_outcomes": [
          "PASS",
          "PASS_WITH_REQUIRED_CORRECTIONS",
          "BLOCKED"
        ],
        "message_template": "Stage {id}: {title} [{outcome}]"
      },
      "audit": {
        "formal": true,
        "report_slug": "post-core-traceability-corrective-audit"
      },
      "codex_timeout_seconds": 7200,
      "notes": [
        "Example metadata only; regenerate from the live repository before activation."
      ]
    },
    {
      "id": "003",
      "sequence": 3,
      "title": "Define and Govern the Narrow Pilot Scope",
      "stage_group": "S2 - MVP Scope and Architecture",
      "prompt_file": "automation/numbered/003-define-and-govern-the-narrow-pilot-scope.md",
      "effort_label": "High",
      "reasoning_effort": "high",
      "kind": "decision_gate",
      "sandbox": "workspace-write",
      "branch_slug": "define-and-govern-the-narrow-pilot-scope",
      "prerequisites": [
        "002"
      ],
      "audit_gate": {
        "mode": "latest_formal",
        "allowed_outcomes": [
          "PASS"
        ]
      },
      "human_approval": {
        "required_before_run": false,
        "approval_files": []
      },
      "context_files": [
        "README.md",
        "docs/current/",
        "docs/adr/",
        "docs/runbooks/",
        "docs/audits/index.json"
      ],
      "allowed_change_paths": [
        "src/**",
        "tests/**",
        "docs/**",
        "scripts/**",
        "pyproject.toml",
        "README.md",
        ".github/**",
        "frontend/**",
        "app/**",
        "migrations/**"
      ],
      "forbidden_change_paths": [
        "automation/**",
        ".codex-loop/**",
        ".git/**"
      ],
      "validation": {
        "commands": [
          {
            "name": "Complete Python test suite",
            "argv": [
              "python3",
              "-m",
              "unittest",
              "discover",
              "-s",
              "tests",
              "-v"
            ],
            "timeout_seconds": 1800
          }
        ]
      },
      "commit": {
        "required": true,
        "allowed_outcomes": [
          "COMPLETED",
          "APPROVAL_REQUIRED"
        ],
        "message_template": "Stage {id}: {title} [{outcome}]"
      },
      "audit": {
        "formal": false,
        "report_slug": ""
      },
      "codex_timeout_seconds": 7200,
      "notes": [
        "Example metadata only; regenerate from the live repository before activation."
      ]
    },
    {
      "id": "004",
      "sequence": 4,
      "title": "Select and Govern the Production Application Stack",
      "stage_group": "S2 - MVP Scope and Architecture",
      "prompt_file": "automation/numbered/004-select-and-govern-the-production-application-stack.md",
      "effort_label": "Ultra",
      "reasoning_effort": "xhigh",
      "kind": "decision_gate",
      "sandbox": "workspace-write",
      "branch_slug": "select-and-govern-the-production-application-stack",
      "prerequisites": [
        "003"
      ],
      "audit_gate": {
        "mode": "latest_formal",
        "allowed_outcomes": [
          "PASS"
        ]
      },
      "human_approval": {
        "required_before_run": false,
        "approval_files": []
      },
      "context_files": [
        "README.md",
        "docs/current/",
        "docs/adr/",
        "docs/runbooks/",
        "docs/audits/index.json"
      ],
      "allowed_change_paths": [
        "src/**",
        "tests/**",
        "docs/**",
        "scripts/**",
        "pyproject.toml",
        "README.md",
        ".github/**",
        "frontend/**",
        "app/**",
        "migrations/**"
      ],
      "forbidden_change_paths": [
        "automation/**",
        ".codex-loop/**",
        ".git/**"
      ],
      "validation": {
        "commands": [
          {
            "name": "Complete Python test suite",
            "argv": [
              "python3",
              "-m",
              "unittest",
              "discover",
              "-s",
              "tests",
              "-v"
            ],
            "timeout_seconds": 1800
          }
        ]
      },
      "commit": {
        "required": true,
        "allowed_outcomes": [
          "COMPLETED",
          "APPROVAL_REQUIRED"
        ],
        "message_template": "Stage {id}: {title} [{outcome}]"
      },
      "audit": {
        "formal": false,
        "report_slug": ""
      },
      "codex_timeout_seconds": 7200,
      "notes": [
        "Example metadata only; regenerate from the live repository before activation."
      ]
    },
    {
      "id": "005",
      "sequence": 5,
      "title": "Bootstrap the Production Application Shell and Engineering Baseline",
      "stage_group": "S2 - MVP Scope and Architecture",
      "prompt_file": "automation/numbered/005-bootstrap-the-production-application-shell-and-engineering-baseline.md",
      "effort_label": "Medium",
      "reasoning_effort": "medium",
      "kind": "implementation",
      "sandbox": "workspace-write",
      "branch_slug": "bootstrap-the-production-application-shell-and-engineering-b",
      "prerequisites": [
        "004"
      ],
      "audit_gate": {
        "mode": "latest_formal",
        "allowed_outcomes": [
          "PASS"
        ]
      },
      "human_approval": {
        "required_before_run": true,
        "approval_files": [
          "automation/approvals/004-production-stack-approved.json"
        ]
      },
      "context_files": [
        "README.md",
        "docs/current/",
        "docs/adr/",
        "docs/runbooks/",
        "docs/audits/index.json"
      ],
      "allowed_change_paths": [
        "src/**",
        "tests/**",
        "docs/**",
        "scripts/**",
        "pyproject.toml",
        "README.md",
        ".github/**",
        "frontend/**",
        "app/**",
        "migrations/**"
      ],
      "forbidden_change_paths": [
        "automation/**",
        ".codex-loop/**",
        ".git/**"
      ],
      "validation": {
        "commands": [
          {